{
  "generated_at_utc": "2026-03-24T06:24:24.015584+00:00",
  "bundle_path": "/Volumes/T7 Touch/mini/rather-not-work-on/platform-planningops/planningops/artifacts/validation/federated-ci-20260324T062058Z-summary-tmp-reconcile-bundle-status-bundle-status-bundle.json",
  "artifact_file": "/Volumes/T7 Touch/mini/rather-not-work-on/platform-planningops/planningops/artifacts/validation/federated-ci-20260324T062058Z-summary-tmp-reconcile-bundle-status-bundle-status.json",
  "bundle_generated_at_utc": "2026-03-24T06:24:24.013729+00:00",
  "bundle_schema_path": "/Volumes/T7 Touch/mini/rather-not-work-on/platform-planningops/planningops/schemas/federated-ci-summary-tmp-reconcile-bundle-status-bundle-status-bundle.schema.json",
  "validation_schema_path": "/Volumes/T7 Touch/mini/rather-not-work-on/platform-planningops/planningops/schemas/federated-ci-summary-tmp-reconcile-bundle-status-bundle-status-bundle-validation.schema.json",
  "status_path": "/Volumes/T7 Touch/mini/rather-not-work-on/platform-planningops/planningops/artifacts/validation/federated-ci-20260324T062058Z-summary-tmp-reconcile-bundle-status-bundle-status.json",
  "status_validation_path": "/Volumes/T7 Touch/mini/rather-not-work-on/platform-planningops/planningops/artifacts/validation/federated-ci-20260324T062058Z-summary-tmp-reconcile-bundle-status-bundle-status-validation.json",
  "run_id": "federated-ci-20260324T062058Z",
  "reconcile_status": "healthy",
  "check_name": "loop-guardrails-outer-status-bundle-validation",
  "reconcile_count": 0,
  "reconcile_validation_verdict": "pass",
  "bundle_validation_verdict": "pass",
  "bundle_validation_state": "fresh",
  "ready": true,
  "next_step": "none",
  "output_path": "/Volumes/T7 Touch/mini/rather-not-work-on/platform-planningops/planningops/artifacts/validation/federated-ci-20260324T062058Z-summary-tmp-reconcile-bundle-status-bundle-status-bundle-validation.json",
  "error_count": 0,
  "warning_count": 0,
  "errors": [],
  "warnings": [],
  "verdict": "pass"
}
